<?xml version="1.0" encoding="UTF-8"?>
<!--
To change this license header, choose License Headers in Project Properties.
To change this template file, choose Tools | Templates
and open the template in the editor.
-->


<ns1:standards
    xmlns:xsi='http://www.w3.org/2001/XMLSchema-instance'
    xmlns:ns1='http://liktek.fr/likacoustik/standards'
    xsi:schemaLocation='http://liktek.fr/likacoustik/standards file:/Users/gauthierlyan/NetBeansProjects/LikacoustikXML/src/java/standards.xsd'>
    
    <ns1:header>Liste des normes acoustiques en vigueur au 1 janvier 2016</ns1:header>
    
    <ns1:standard unit="Db">
        <ns1:reference>103-TRD</ns1:reference>
        <ns1:value>45</ns1:value>
    </ns1:standard>

    <ns1:standard unit="Db FS">
        <ns1:reference>105-TRD</ns1:reference>
        <ns1:value>34</ns1:value>
    </ns1:standard>
    
    <ns1:standard unit="Db">
        <ns1:reference>119-TRD</ns1:reference>
        <ns1:value>45</ns1:value>
    </ns1:standard>



</ns1:standards>
